{
  "correlation_id": "corr_partnerprogram_webhook_dead_letter_replay",
  "replay_mode": "retry_now",
  "record": {
    "delivery_id": "wh_deliv_001",
    "partner_id": "ops-admin",
    "event_type": "proposal.created",
    "endpoint": "https://partner.example.com/webhooks/swapgraph",
    "attempt_count": 3,
    "max_attempts": 3,
    "first_attempt_at": "2026-02-20T02:00:00.000Z",
    "last_attempt_at": "2026-02-20T02:12:00.000Z",
    "next_retry_at": "2026-02-20T02:20:00.000Z",
    "last_error_code": "http_503",
    "last_status": "failed",
    "dead_lettered": true,
    "dead_lettered_at": "2026-02-20T02:12:00.000Z",
    "replayed": true,
    "replayed_at": "2026-02-20T02:20:00.000Z",
    "retry_policy": {
      "max_attempts": 3,
      "backoff_seconds": 300
    },
    "metadata": {
      "http_status": 503,
      "request_id": "req_abc123",
      "replay_mode": "retry_now",
      "backfill_reference": "dlq_batch_2026_02_20"
    }
  },
  "summary": {
    "total_attempts": 7,
    "deliveries_count": 3,
    "dead_letter_count": 2,
    "pending_retry_count": 1,
    "replayed_count": 1
  },
  "replayed": false
}
